{
  "$schema": "https://raw.githubusercontent.com/riteofstring/code-polishy/main/schema/code-polishy-language-conformance-fixture-v1.schema.json",
  "protocol": "language-conformance-fixture/v1",
  "id": "javascript-dependencies",
  "maturity": "planned",
  "gap": "Capture Node and package-manager pins, package/workspace/lock ownership, pnpm reconciliation, source protocols, peer and override policy, licenses, lifecycle scripts, audit, OSV, release age, and platform packages with controlled registry inputs.",
  "behaviorIds": [
    "javascript.dependencies.manifest-lock",
    "javascript.dependencies.audit-license-release-age"
  ],
  "files": [
    {
      "path": ".code-polishy.json",
      "mode": "0644",
      "content": "{\"version\":4,\"project\":{\"kind\":\"application\",\"capabilities\":[]},\"modules\":[{\"name\":\"application\",\"paths\":[\"src/**\"]}],\"tests\":{\"ownership\":[],\"suites\":[]}}\n"
    },
    {
      "path": "package.json",
      "mode": "0644",
      "content": "{\"name\":\"conformance\",\"private\":true,\"type\":\"module\",\"packageManager\":\"pnpm@11.13.0\",\"dependencies\":{\"example\":\"^1.0.0\"}}\n"
    },
    {
      "path": "src/index.js",
      "mode": "0644",
      "content": "export const value = 1;\n"
    }
  ],
  "arguments": ["supply-chain", "--offline", "--format", "json"],
  "timeoutSeconds": 900,
  "platforms": [
    "darwin-amd64",
    "darwin-arm64",
    "linux-amd64",
    "linux-arm64",
    "windows-amd64"
  ],
  "expected": {
    "exitStatus": 1,
    "reportStatus": "failed",
    "requiredRules": ["supplyChain.lockCoverage"],
    "requiredCoverage": [],
    "writes": [],
    "protected": [".code-polishy.json", "package.json", "src/index.js"]
  }
}
