{
  "$schema": "https://raw.githubusercontent.com/riteofstring/code-polishy/main/schema/code-polishy-language-conformance-fixture-v1.schema.json",
  "protocol": "language-conformance-fixture/v1",
  "id": "python-dependencies",
  "maturity": "planned",
  "gap": "Capture PEP 508 requirements, groups, extras, markers, build requirements, uv reconciliation, exact versions, local and Git sources, signatures, OSV, release age, and missing or malformed environment failures with controlled inputs.",
  "behaviorIds": [
    "python.dependencies.requirements-lock",
    "python.dependencies.git-provenance",
    "python.dependencies.vulnerability-release-age"
  ],
  "files": [
    {
      "path": ".code-polishy.json",
      "mode": "0644",
      "content": "{\"version\":4,\"project\":{\"kind\":\"application\",\"capabilities\":[]},\"modules\":[{\"name\":\"application\",\"paths\":[\"src/**\"]}],\"tests\":{\"ownership\":[],\"suites\":[]}}\n"
    },
    {
      "path": "pyproject.toml",
      "mode": "0644",
      "content": "[project]\nname = \"conformance\"\nversion = \"1.0.0\"\nrequires-python = \"==3.12.*\"\ndependencies = [\"example>=1\"]\n"
    },
    { "path": "src/app.py", "mode": "0644", "content": "VALUE = 1\n" }
  ],
  "arguments": ["supply-chain", "--offline", "--format", "json"],
  "timeoutSeconds": 900,
  "platforms": [
    "darwin-amd64",
    "darwin-arm64",
    "linux-amd64",
    "linux-arm64",
    "windows-amd64"
  ],
  "expected": {
    "exitStatus": 1,
    "reportStatus": "failed",
    "requiredRules": ["supplyChain.lockCoverage"],
    "requiredCoverage": [],
    "writes": [],
    "protected": [".code-polishy.json", "pyproject.toml", "src/app.py"]
  }
}
